{
  "$schema": "../schema.json",
  "id": "impossible-cloud",
  "name": "Impossible Cloud",
  "type": "alternative",
  "url": "https://www.impossiblecloud.com",
  "verified": "Mar 2026",
  "bestFor": ["backup", "multicloud"],
  "migrationEase": "High (S3 compatible, migration tools)",
  "gotchas": "Newer provider — smaller community. EU-focused (Germany). Marketing-heavy on '60-80% savings' — verify for your workload.",
  "pricing": {
    "storageStd": 0.006,
    "storageIA": null,
    "storageArchive": null,
    "storageDeep": null,
    "egressPerGB": 0,
    "egressFree": "Free (no egress charges)",
    "putPer1k": 0,
    "getPer1k": 0,
    "retrievalFee": "None",
    "minRetention": "None",
    "billing": "Per-hour",
    "freeTier": "Not published"
  },
  "features": {
    "tiers": 1,
    "tierNames": "Always-Hot (single tier)",
    "autoTier": false,
    "versioning": true,
    "lifecycle": true,
    "objectLock": true,
    "eventNotify": false,
    "notifyFormat": "None",
    "s3Compat": "Full",
    "apiDepth": "High (core S3 ops)"
  },
  "infrastructure": {
    "durability": "99.999999999%",
    "availSLA": "99.9%",
    "regions": 3,
    "geoNA": true,
    "geoEU": true,
    "geoAPAC": false,
    "multiRegion": false,
    "edgePops": null,
    "consistency": "Strong read-after-write"
  },
  "performance": {
    "ttfbP50": "~15–30 ms",
    "ttfbP99": "~60–120 ms",
    "throughput": "~100 MB/s",
    "reqLimitGET": "Not published",
    "reqLimitPUT": "Not published",
    "throttle": "Not published"
  },
  "limits": {
    "maxBuckets": "Not published",
    "maxObjSize": "5 TB",
    "maxMetaKB": "Not published"
  },
  "dataProtection": {
    "replication": false,
    "replRPO": null,
    "softDelete": false,
    "legalHold": false,
    "mfaDelete": false,
    "pitRestore": false
  },
  "advancedS3": {
    "selectQuery": false,
    "batchOps": false,
    "inventory": false,
    "accessLog": false,
    "deltaIceberg": "None"
  },
  "security": {
    "sseS3": true,
    "sseKMS": false,
    "sseC": false,
    "encryptDefault": true
  },
  "compliance": {
    "soc2": true,
    "hipaa": false,
    "iso27001": true,
    "gdpr": true
  },
  "ecosystem": {
    "cdn": "None native",
    "staticHost": false,
    "transferAccel": false,
    "nativeCompute": "None",
    "nativeAnalytics": "None"
  }
}
