{
  "$schema": "../schema.json",
  "id": "nebius",
  "name": "Nebius AI Cloud",
  "type": "alternative",
  "url": "https://nebius.com/services/storage",
  "verified": "Apr 2026",
  "bestFor": ["aiml", "datalake"],
  "migrationEase": "High (S3 compatible)",
  "gotchas": "EU-based (ex-Yandex Cloud spin-off). Smaller region footprint. Newer brand, less track record.",
  "pricing": {
    "storageStd": 0.0164,
    "storageIA": 0.008,
    "storageArchive": 0.003,
    "storageDeep": null,
    "egressPerGB": 0.01,
    "egressFree": "None standard; free internal",
    "putPer1k": 0.004,
    "getPer1k": 0.0004,
    "retrievalFee": "$0.01/GB (Cold); restore fee (Ice)",
    "minRetention": "30d IA; 90d Cold",
    "billing": "Per-hour",
    "freeTier": "Initial grant for new accounts"
  },
  "features": {
    "tiers": 4,
    "tierNames": "Standard, IA, Cold, Ice",
    "autoTier": false,
    "versioning": true,
    "lifecycle": true,
    "objectLock": true,
    "eventNotify": false,
    "notifyFormat": "None",
    "s3Compat": "Full",
    "apiDepth": "High"
  },
  "infrastructure": {
    "durability": "99.999999999%",
    "availSLA": "99.95%",
    "regions": 3,
    "geoNA": false,
    "geoEU": true,
    "geoAPAC": false,
    "multiRegion": false,
    "edgePops": null,
    "consistency": "Strong read-after-write"
  },
  "performance": {
    "ttfbP50": "~10–30 ms",
    "ttfbP99": "~50–100 ms",
    "throughput": "500+ GB/s (filesystem tier)",
    "reqLimitGET": "Not published",
    "reqLimitPUT": "Not published",
    "throttle": "Service limits"
  },
  "limits": {
    "maxBuckets": "Not published",
    "maxObjSize": "5 TB",
    "maxMetaKB": "Not published"
  },
  "dataProtection": {
    "replication": false,
    "replRPO": null,
    "softDelete": false,
    "legalHold": false,
    "mfaDelete": false,
    "pitRestore": false
  },
  "advancedS3": {
    "selectQuery": false,
    "batchOps": false,
    "inventory": false,
    "accessLog": true,
    "deltaIceberg": "Spark integration via Nebius Data Platform"
  },
  "security": {
    "sseS3": true,
    "sseKMS": true,
    "sseC": false,
    "encryptDefault": true
  },
  "compliance": {
    "soc2": true,
    "hipaa": false,
    "iso27001": true,
    "gdpr": true
  },
  "ecosystem": {
    "cdn": "None native",
    "staticHost": true,
    "transferAccel": false,
    "nativeCompute": "Nebius GPU instances (H100, L40S)",
    "nativeAnalytics": "Nebius Data Platform (Spark, Trino)"
  }
}
